Sentence,Tags,Parse,Noun,Index,Relevant Dependencies,Noun Tag,Verb,Verb Tag,Prepositional Position,Prepositional Phrase,Determiners,Adjectival Modifiers,Possesives,Numeric Modifiers,Case Modifiers,Adverbial Modifiers,Denumerator,Type of Denumerator,Plurality of Noun,Plurality of Verb,Allan Tests Passed,Countability
"While most other cities have shown a drop in crime over the last few years, Camden's trend continues upward","While/IN most/RBS other/JJ cities/NNS have/VBP shown/VBN a/DT drop/NN in/IN crime/NN over/IN the/DT last/JJ few/JJ years/NNS ,/, Camden/NNP 's/POS trend/NN continues/VBZ upward/RB","mark(shown-6, While-1) advmod(cities-4, most-2) amod(cities-4, other-3) nsubj(shown-6, cities-4) aux(shown-6, have-5) root(ROOT-0, shown-6) det(drop-8, a-7) dobj(shown-6, drop-8) case(crime-10, in-9) nmod:in(drop-8, crime-10) case(years-15, over-11) det(years-15, the-12) amod(years-15, last-13) amod(years-15, few-14) nmod:over(shown-6, years-15) nmod:poss(trend-19, Camden-17) case(Camden-17, 's-18) nsubj(continues-20, trend-19) dep(shown-6, continues-20) advmod(continues-20, upward-21)",crime,10,"case(crime-10, in-9) nmod:in(drop-8, crime-10) ",NN,,,modifier,"[('in', 'drop')]",[],[],[],[],['in'],[],,,singular,,,unknown
"Violent crimes, like murder, rape, and robbery, increased 8.8 percent in Camden from 1994 to 1995, according to Federal Bureau of Investigation data.","Violent/JJ crimes/NNS ,/, like/IN murder/NN ,/, rape/NN ,/, and/CC robbery/NN ,/, increased/VBD 8.8/CD percent/NN in/IN Camden/NNP from/IN 1994/CD to/TO 1995/CD ,/, according/VBG to/TO Federal/NNP Bureau/NNP of/IN Investigation/NNP data/NNS ./.","amod(crimes-2, Violent-1) nsubj(increased-12, crimes-2) case(murder-5, like-4) nmod:like(crimes-2, murder-5) nmod:like(crimes-2, rape-7) conj:and(murder-5, rape-7) cc(murder-5, and-9) nmod:like(crimes-2, robbery-10) conj:and(murder-5, robbery-10) root(ROOT-0, increased-12) nummod(percent-14, 8.8-13) dobj(increased-12, percent-14) case(Camden-16, in-15) nmod:in(percent-14, Camden-16) case(1995-20, from-17) nummod(1995-20, 1994-18) dep(1995-20, to-19) nmod:from(increased-12, 1995-20) case(Bureau-25, according-22) mwe(according-22, to-23) compound(Bureau-25, Federal-24) nmod:according_to(increased-12, Bureau-25) case(data-28, of-26) compound(data-28, Investigation-27) nmod:of(Bureau-25, data-28)",crimes,2,"amod(crimes-2, Violent-1) nmod:like(crimes-2, murder-5) nmod:like(crimes-2, rape-7) nmod:like(crimes-2, robbery-10) nsubj(increased-12, crimes-2) ",NNS,increased,VBD,modified,"[('like', 'murder'), ('like', 'rape'), ('like', 'robbery')]",[],['Violent'],[],[],[],[],,,plural,ambiguous,,unknown
"There are 140 reported crimes per 1,000 residents in Camden each year, the highest rate in New Jersey, according to state police figures","There/RB are/VBP 140/CD reported/JJ crimes/NNS per/IN 1,000/CD residents/NNS in/IN Camden/NNP each/DT year/NN ,/, the/DT highest/JJS rate/NN in/IN New/NNP Jersey/NNP ,/, according/VBG to/TO state/NN police/NN figures/NNS","advmod(crimes-5, There-1) cop(crimes-5, are-2) nummod(crimes-5, 140-3) amod(crimes-5, reported-4) root(ROOT-0, crimes-5) case(residents-8, per-6) nummod(residents-8, 1,000-7) nmod:per(crimes-5, residents-8) case(Camden-10, in-9) nmod:in(residents-8, Camden-10) det(year-12, each-11) nsubj(crimes-5, year-12) det(rate-16, the-14) amod(rate-16, highest-15) appos(year-12, rate-16) case(Jersey-19, in-17) compound(Jersey-19, New-18) nmod:in(rate-16, Jersey-19) case(figures-25, according-21) mwe(according-21, to-22) compound(figures-25, state-23) compound(figures-25, police-24) nmod:according_to(crimes-5, figures-25)",crimes,5,"advmod(crimes-5, There-1) cop(crimes-5, are-2) nummod(crimes-5, 140-3) amod(crimes-5, reported-4) nmod:per(crimes-5, residents-8) nsubj(crimes-5, year-12) nmod:according_to(crimes-5, figures-25) root(ROOT-0, crimes-5) ",NNS,,,modified,"[('per', 'residents'), ('according_to', 'figures')]",[],['reported'],[],['140'],[],['There'],140,other,plural,,O-DEN,countable
" At a time when Hearst's Journal and Pulitzer's World were peddling sex, crime, war over Cuba and rival versions of a popular cartoon called ""The Yellow Kid,"" Och's Times rejected all these staples of what the cartoon caused to be called the ""yellow press.""","At/IN a/DT time/NN when/WRB Hearst/NNP 's/POS Journal/NNP and/CC Pulitzer/NNP 's/POS World/NNP were/VBD peddling/VBG sex/NN ,/, crime/NN ,/, war/NN over/IN Cuba/NNP and/CC rival/JJ versions/NNS of/IN a/DT popular/JJ cartoon/NN called/VBN ``/`` The/DT Yellow/JJ Kid/NN ,/, ''/'' Och/NNP 's/POS Times/NNP rejected/VBD all/PDT these/DT staples/NNS of/IN what/WP the/DT cartoon/NN caused/VBD to/TO be/VB called/VBN the/DT ``/`` yellow/JJ press/NN ./. ''/''","case(time-3, At-1) det(time-3, a-2) nmod:at(rejected-38, time-3) advmod(peddling-13, when-4) nmod:poss(Journal-7, Hearst-5) case(Hearst-5, 's-6) nsubj(peddling-13, Journal-7) cc(Journal-7, and-8) nmod:poss(World-11, Pulitzer-9) case(Pulitzer-9, 's-10) conj:and(Journal-7, World-11) nsubj(peddling-13, World-11) aux(peddling-13, were-12) acl:relcl(time-3, peddling-13) dobj(peddling-13, sex-14) dobj(peddling-13, crime-16) conj:and(sex-14, crime-16) dobj(peddling-13, war-18) conj:and(sex-14, war-18) case(Cuba-20, over-19) nmod:over(war-18, Cuba-20) cc(sex-14, and-21) amod(versions-23, rival-22) dobj(peddling-13, versions-23) conj:and(sex-14, versions-23) case(cartoon-27, of-24) det(cartoon-27, a-25) amod(cartoon-27, popular-26) nmod:of(versions-23, cartoon-27) acl(cartoon-27, called-28) det(Kid-32, The-30) amod(Kid-32, Yellow-31) xcomp(called-28, Kid-32) nmod:poss(Times-37, Och-35) case(Och-35, 's-36) nsubj(rejected-38, Times-37) root(ROOT-0, rejected-38) det:predet(staples-41, all-39) det(staples-41, these-40) dobj(rejected-38, staples-41) mark(caused-46, of-42) dobj(caused-46, what-43) nsubjpass(called-49, what-43) det(cartoon-45, the-44) nsubj(caused-46, cartoon-45) acl(staples-41, caused-46) mark(called-49, to-47) auxpass(called-49, be-48) xcomp(caused-46, called-49) det(press-53, the-50) amod(press-53, yellow-52) dobj(called-49, press-53) ",crime,16,"dobj(peddling-13, crime-16) conj:and(sex-14, crime-16) ",NN,peddling,VBG,,[],[],[],[],[],[],[],,,singular,ambiguous,,unknown
"laboratory in Washington, investigators face a possibility that the only evidence of a crime would be forensic experts' subjective analysis of the damage to metal debris","laboratory/NN in/IN Washington/NNP ,/, investigators/NNS face/VBP a/DT possibility/NN that/IN the/DT only/JJ evidence/NN of/IN a/DT crime/NN would/MD be/VB forensic/JJ experts/NNS '/POS subjective/JJ analysis/NN of/IN the/DT damage/NN to/TO metal/NN debris/NN","nsubj(face-6, laboratory-1) case(Washington-3, in-2) nmod:in(laboratory-1, Washington-3) appos(Washington-3, investigators-5) root(ROOT-0, face-6) det(possibility-8, a-7) dobj(face-6, possibility-8) mark(analysis-22, that-9) det(evidence-12, the-10) amod(evidence-12, only-11) nsubj(analysis-22, evidence-12) case(crime-15, of-13) det(crime-15, a-14) nmod:of(evidence-12, crime-15) aux(analysis-22, would-16) cop(analysis-22, be-17) amod(experts-19, forensic-18) nmod:poss(analysis-22, experts-19) case(experts-19, '-20) amod(analysis-22, subjective-21) ccomp(face-6, analysis-22) case(damage-25, of-23) det(damage-25, the-24) nmod:of(analysis-22, damage-25) case(debris-28, to-26) compound(debris-28, metal-27) nmod:to(damage-25, debris-28)",crime,15,"case(crime-15, of-13) det(crime-15, a-14) nmod:of(evidence-12, crime-15) ",NN,,,modifier,"[('of', 'evidence')]",['a'],[],[],[],['of'],[],a,unit,singular,,A+N,countable
"In order to get a job, an American is going to have to go commit a crime","In/IN order/NN to/TO get/VB a/DT job/NN ,/, an/DT American/NNP is/VBZ going/VBG to/TO have/VB to/TO go/VB commit/VB a/DT crime/NN","mark(get-4, In-1) mwe(In-1, order-2) mark(get-4, to-3) advcl(going-11, get-4) det(job-6, a-5) dobj(get-4, job-6) det(American-9, an-8) nsubj(going-11, American-9) nsubj(have-13, American-9) nsubj(go-15, American-9) aux(going-11, is-10) root(ROOT-0, going-11) mark(have-13, to-12) xcomp(going-11, have-13) mark(go-15, to-14) xcomp(have-13, go-15) xcomp(go-15, commit-16) det(crime-18, a-17) dobj(commit-16, crime-18)",crime,18,"det(crime-18, a-17) dobj(commit-16, crime-18) ",NN,commit,VB,,[],['a'],[],[],[],[],[],a,unit,singular,ambiguous,A+N,countable
