<p> Only one species of tsetse fly was found to inhabit the Zanzibar island of Unguja .,<p>/JJ Only/RB one/CD species/NNS of/IN tsetse/JJ fly/NN was/VBD found/VBN to/TO inhabit/VB the/DT Zanzibar/NNP island/NN of/IN Unguja/NNP ./.," amod(species-4, <p>-1) advmod(species-4, Only-2) nummod(species-4, one-3) nsubjpass(found-9, species-4) nsubj(inhabit-11, species-4) case(fly-7, of-5) amod(fly-7, tsetse-6) nmod:of(species-4, fly-7) auxpass(found-9, was-8) root(ROOT-0, found-9) mark(inhabit-11, to-10) xcomp(found-9, inhabit-11) det(island-14, the-12) compound(island-14, Zanzibar-13) dobj(inhabit-11, island-14) case(Unguja-16, of-15) nmod:of(island-14, Unguja-16)  ",fly,7,"case(fly-7, of-5) amod(fly-7, tsetse-6) nmod:of(species-4, fly-7) ",Only one species of tsetse fly was found to inhabit the,NN,[],,,,,"[('of', 'species')]",['of'],['species'],[],[],[],[],['tsetse'],[],[],[],['of'],[],[],[],[],,,singular,,,unknown,unknown
"With the advent of synthetic insecticides in the mid-1940s , ground spraying of tsetse fly habitat with persistent organochlorines , was introduced .","With/IN the/DT advent/NN of/IN synthetic/JJ insecticides/NNS in/IN the/DT mid-1940s/NNS ,/, ground/NN spraying/NNS of/IN tsetse/JJ fly/NN habitat/NN with/IN persistent/JJ organochlorines/NNS ,/, was/VBD introduced/VBN ./."," case(advent-3, With-1) det(advent-3, the-2) nmod:with(introduced-22, advent-3) case(insecticides-6, of-4) amod(insecticides-6, synthetic-5) nmod:of(advent-3, insecticides-6) case(mid-1940s-9, in-7) det(mid-1940s-9, the-8) nmod:in(insecticides-6, mid-1940s-9) compound(spraying-12, ground-11) nsubjpass(introduced-22, spraying-12) case(habitat-16, of-13) amod(habitat-16, tsetse-14) compound(habitat-16, fly-15) nmod:of(spraying-12, habitat-16) case(organochlorines-19, with-17) amod(organochlorines-19, persistent-18) nmod:with(habitat-16, organochlorines-19) auxpass(introduced-22, was-21) root(ROOT-0, introduced-22)  ",fly,15,"compound(habitat-16, fly-15) ",", ground spraying of tsetse fly habitat with persistent organochlorines ,",NN,[],,,,,[],[],[],[],[],[],['habitat'],[],[],[],[],[],[],[],[],[],,,singular,,,unknown,unknown
"<p> New techniques were then developed in the 1970s and 1980s using small quantities of residual insecticides applied to screens and targets , and powerful new olfactory attractants used to enhance trap catches , that together could reduce fly numbers significantly and did not accumulate in food chains .","<p>/NNP New/NNP techniques/NNS were/VBD then/RB developed/VBN in/IN the/DT 1970s/CD and/CC 1980s/CD using/VBG small/JJ quantities/NNS of/IN residual/JJ insecticides/NNS applied/VBN to/TO screens/NNS and/CC targets/NNS ,/, and/CC powerful/JJ new/JJ olfactory/NN attractants/NNS used/VBD to/TO enhance/VB trap/NN catches/NNS ,/, that/WDT together/RB could/MD reduce/VB fly/NN numbers/NNS significantly/RB and/CC did/VBD not/RB accumulate/VB in/IN food/NN chains/NNS ./."," compound(techniques-3, <p>-1) compound(techniques-3, New-2) nsubjpass(developed-6, techniques-3) auxpass(developed-6, were-4) advmod(developed-6, then-5) root(ROOT-0, developed-6) case(1970s-9, in-7) dep(1970s-9, the-8) nmod:in(developed-6, 1970s-9) cc(1970s-9, and-10) nmod:in(developed-6, 1980s-11) conj:and(1970s-9, 1980s-11) xcomp(developed-6, using-12) amod(quantities-14, small-13) dobj(using-12, quantities-14) case(insecticides-17, of-15) amod(insecticides-17, residual-16) nmod:of(quantities-14, insecticides-17) acl(insecticides-17, applied-18) case(screens-20, to-19) nmod:to(applied-18, screens-20) cc(screens-20, and-21) nmod:to(applied-18, targets-22) conj:and(screens-20, targets-22) cc(developed-6, and-24) amod(attractants-28, powerful-25) amod(attractants-28, new-26) compound(attractants-28, olfactory-27) nsubj(used-29, attractants-28) nsubj(enhance-31, attractants-28) nsubj(accumulate-45, attractants-28) conj:and(developed-6, used-29) mark(enhance-31, to-30) xcomp(used-29, enhance-31) compound(catches-33, trap-32) dobj(enhance-31, catches-33) nsubj(reduce-38, catches-33) ref(catches-33, that-35) advmod(reduce-38, together-36) aux(reduce-38, could-37) acl:relcl(catches-33, reduce-38) compound(numbers-40, fly-39) dobj(reduce-38, numbers-40) advmod(reduce-38, significantly-41) cc(used-29, and-42) aux(accumulate-45, did-43) neg(accumulate-45, not-44) conj:and(developed-6, accumulate-45) conj:and(used-29, accumulate-45) case(chains-48, in-46) compound(chains-48, food-47) nmod:in(accumulate-45, chains-48)  ",fly,39,"compound(numbers-40, fly-39) ",", that together could reduce fly numbers significantly and did not",NN,[],reduce,VB,object,[],[],[],[],[],[],[],['numbers'],[],[],[],[],[],[],[],[],[],,,singular,ambiguous,,unknown,unknown
"<p> Progress was also made in developing new trapping techniques for G. austeni using blue/white sticky traps and insecticide ( synthetic pyrethroid ) impregnated blue cloth screens , which reduced the fly population substantially.","<p>/NNP Progress/NNP was/VBD also/RB made/VBN in/IN developing/VBG new/JJ trapping/NN techniques/NNS for/IN G./NNP austeni/NNS using/VBG blue/white/JJ sticky/JJ traps/NNS and/CC insecticide/NN -LRB-/-LRB- synthetic/JJ pyrethroid/NN -RRB-/-RRB- impregnated/VBD blue/JJ cloth/NN screens/NNS ,/, which/WDT reduced/VBD the/DT fly/NN population/NN substantially/RB ./."," compound(Progress-2, <p>-1) nsubjpass(made-5, Progress-2) auxpass(made-5, was-3) advmod(made-5, also-4) root(ROOT-0, made-5) mark(developing-7, in-6) advcl(made-5, developing-7) amod(techniques-10, new-8) compound(techniques-10, trapping-9) dobj(developing-7, techniques-10) mark(using-14, for-11) compound(austeni-13, G.-12) nsubj(using-14, austeni-13) advcl(developing-7, using-14) amod(traps-17, blue/white-15) amod(traps-17, sticky-16) dobj(using-14, traps-17) cc(made-5, and-18) nsubj(impregnated-24, insecticide-19) amod(pyrethroid-22, synthetic-21) appos(insecticide-19, pyrethroid-22) conj:and(made-5, impregnated-24) amod(screens-27, blue-25) compound(screens-27, cloth-26) dobj(impregnated-24, screens-27) nsubj(reduced-30, screens-27) ref(screens-27, which-29) acl:relcl(screens-27, reduced-30) det(population-33, the-31) compound(population-33, fly-32) dobj(reduced-30, population-33) advmod(reduced-30, substantially-34)  ",fly,32,"compound(population-33, fly-32) ","screens , which reduced the fly population substantially.",NN,[],reduced,VBD,object,[],[],[],[],[],[],[],['population'],[],[],[],[],[],[],[],[],[],,,singular,ambiguous,,unknown,unknown
"Different colors , it was discovered , elicit different responses from tsetse , some attracting the flies without inducing them to land , others inducing them to land if the fly is close but not attracting from a distance .","Different/JJ colors/NNS ,/, it/PRP was/VBD discovered/VBN ,/, elicit/VB different/JJ responses/NNS from/IN tsetse/NN ,/, some/DT attracting/VBG the/DT flies/NNS without/IN inducing/VBG them/PRP to/TO land/NN ,/, others/NNS inducing/VBG them/PRP to/TO land/VB if/IN the/DT fly/NN is/VBZ close/JJ but/CC not/RB attracting/VBG from/IN a/DT distance/NN ./."," amod(colors-2, Different-1) nsubj(elicit-8, colors-2) nsubjpass(discovered-6, it-4) auxpass(discovered-6, was-5) parataxis(elicit-8, discovered-6) root(ROOT-0, elicit-8) amod(responses-10, different-9) dobj(elicit-8, responses-10) case(tsetse-12, from-11) nmod:from(elicit-8, tsetse-12) dobj(elicit-8, some-14) acl(some-14, attracting-15) det(flies-17, the-16) dobj(attracting-15, flies-17) mark(inducing-19, without-18) advcl(attracting-15, inducing-19) dobj(inducing-19, them-20) case(land-22, to-21) nmod:to(inducing-19, land-22) appos(land-22, others-24) acl(others-24, inducing-25) dobj(inducing-25, them-26) nsubj(land-28, them-26) mark(land-28, to-27) xcomp(inducing-25, land-28) mark(close-33, if-29) det(fly-31, the-30) nsubj(close-33, fly-31) cop(close-33, is-32) advcl(land-28, close-33) cc(not-35, but-34) cc(inducing-19, not-35) advcl(attracting-15, attracting-36) conj:negcc(inducing-19, attracting-36) case(distance-39, from-37) det(distance-39, a-38) nmod:from(attracting-36, distance-39)  ",flies,17,"det(flies-17, the-16) dobj(attracting-15, flies-17) ","tsetse , some attracting the flies without inducing them to land",NNS,[],attracting,VBG,object,[],[],[],[],[],['the'],[],[],[],[],[],[],[],[],[],[],[],,,plural,ambiguous,,unknown,unknown
"Different colors , it was discovered , elicit different responses from tsetse , some attracting the flies without inducing them to land , others inducing them to land if the fly is close but not attracting from a distance .","Different/JJ colors/NNS ,/, it/PRP was/VBD discovered/VBN ,/, elicit/VB different/JJ responses/NNS from/IN tsetse/NN ,/, some/DT attracting/VBG the/DT flies/NNS without/IN inducing/VBG them/PRP to/TO land/NN ,/, others/NNS inducing/VBG them/PRP to/TO land/VB if/IN the/DT fly/NN is/VBZ close/JJ but/CC not/RB attracting/VBG from/IN a/DT distance/NN ./."," amod(colors-2, Different-1) nsubj(elicit-8, colors-2) nsubjpass(discovered-6, it-4) auxpass(discovered-6, was-5) parataxis(elicit-8, discovered-6) root(ROOT-0, elicit-8) amod(responses-10, different-9) dobj(elicit-8, responses-10) case(tsetse-12, from-11) nmod:from(elicit-8, tsetse-12) dobj(elicit-8, some-14) acl(some-14, attracting-15) det(flies-17, the-16) dobj(attracting-15, flies-17) mark(inducing-19, without-18) advcl(attracting-15, inducing-19) dobj(inducing-19, them-20) case(land-22, to-21) nmod:to(inducing-19, land-22) appos(land-22, others-24) acl(others-24, inducing-25) dobj(inducing-25, them-26) nsubj(land-28, them-26) mark(land-28, to-27) xcomp(inducing-25, land-28) mark(close-33, if-29) det(fly-31, the-30) nsubj(close-33, fly-31) cop(close-33, is-32) advcl(land-28, close-33) cc(not-35, but-34) cc(inducing-19, not-35) advcl(attracting-15, attracting-36) conj:negcc(inducing-19, attracting-36) case(distance-39, from-37) det(distance-39, a-38) nmod:from(attracting-36, distance-39)  ",fly,31,"det(fly-31, the-30) nsubj(close-33, fly-31) ",them to land if the fly is close but not attracting,NN,[],is,VBZ,subject,[],[],[],[],[],['the'],[],[],[],[],[],[],[],[],[],[],[],,,singular,singular,,unknown,unknown
"Nevertheless , the program substantially reduced the target population and lay the groundwork for the first efficient and sustainable application of the Sterile Insect Technique ( SIT ) against the tsetse fly .","Nevertheless/RB ,/, the/DT program/NN substantially/RB reduced/VBD the/DT target/NN population/NN and/CC lay/VBD the/DT groundwork/NN for/IN the/DT first/JJ efficient/JJ and/CC sustainable/JJ application/NN of/IN the/DT Sterile/NNP Insect/NNP Technique/NNP -LRB-/-LRB- SIT/NNP -RRB-/-RRB- against/IN the/DT tsetse/JJ fly/NN ./."," advmod(reduced-6, Nevertheless-1) det(program-4, the-3) nsubj(reduced-6, program-4) nsubj(lay-11, program-4) advmod(reduced-6, substantially-5) root(ROOT-0, reduced-6) det(population-9, the-7) compound(population-9, target-8) dobj(reduced-6, population-9) cc(reduced-6, and-10) conj:and(reduced-6, lay-11) det(groundwork-13, the-12) dobj(lay-11, groundwork-13) case(application-20, for-14) det(application-20, the-15) amod(application-20, first-16) amod(application-20, efficient-17) cc(efficient-17, and-18) conj:and(efficient-17, sustainable-19) amod(application-20, sustainable-19) nmod:for(lay-11, application-20) case(Technique-25, of-21) det(Technique-25, the-22) compound(Technique-25, Sterile-23) compound(Technique-25, Insect-24) nmod:of(application-20, Technique-25) appos(Technique-25, SIT-27) case(fly-32, against-29) det(fly-32, the-30) amod(fly-32, tsetse-31) nmod:against(lay-11, fly-32)  ",fly,32,"case(fly-32, against-29) det(fly-32, the-30) amod(fly-32, tsetse-31) nmod:against(lay-11, fly-32) ",SIT ) against the tsetse fly .,NN,[],,,,,"[('against', 'lay')]",['against'],['lay'],[],['the'],[],[],['tsetse'],[],[],[],['against'],[],[],[],[],,,singular,,,unknown,unknown
Eradication was never achieved in Zimbabwe because the experimental area ( a ranch ) was part of a larger fly belt .,Eradication/NNP was/VBD never/RB achieved/VBN in/IN Zimbabwe/NNP because/IN the/DT experimental/JJ area/NN -LRB-/-LRB- a/DT ranch/NN -RRB-/-RRB- was/VBD part/NN of/IN a/DT larger/JJR fly/NN belt/NN ./.," nsubjpass(achieved-4, Eradication-1) auxpass(achieved-4, was-2) neg(achieved-4, never-3) root(ROOT-0, achieved-4) case(Zimbabwe-6, in-5) nmod:in(achieved-4, Zimbabwe-6) mark(part-16, because-7) det(area-10, the-8) amod(area-10, experimental-9) nsubj(part-16, area-10) det(ranch-13, a-12) appos(area-10, ranch-13) cop(part-16, was-15) advcl(achieved-4, part-16) case(belt-21, of-17) det(belt-21, a-18) amod(belt-21, larger-19) compound(belt-21, fly-20) nmod:of(part-16, belt-21)  ",fly,20,"compound(belt-21, fly-20) ",was part of a larger fly belt .,NN,[],,,,,[],[],[],[],[],[],['belt'],[],[],[],[],[],[],[],[],[],,,singular,,,unknown,unknown
"5 These programs achieved eradication of the target species over wide areas , but , in the absence of natural boundaries and sufficient follow-on activities , the successes were lost to subsequent fly re-invasions .","5/CD These/DT programs/NNS achieved/VBD eradication/NN of/IN the/DT target/NN species/NN over/IN wide/JJ areas/NNS ,/, but/CC ,/, in/IN the/DT absence/NN of/IN natural/JJ boundaries/NNS and/CC sufficient/JJ follow-on/JJ activities/NNS ,/, the/DT successes/NNS were/VBD lost/VBN to/TO subsequent/JJ fly/NN re-invasions/NNS ./."," nsubj(achieved-4, 5-1) det(programs-3, These-2) dep(5-1, programs-3) root(ROOT-0, achieved-4) dobj(achieved-4, eradication-5) case(species-9, of-6) det(species-9, the-7) compound(species-9, target-8) nmod:of(eradication-5, species-9) case(areas-12, over-10) amod(areas-12, wide-11) nmod:over(achieved-4, areas-12) cc(achieved-4, but-14) case(absence-18, in-16) det(absence-18, the-17) nmod:in(lost-30, absence-18) case(boundaries-21, of-19) amod(boundaries-21, natural-20) nmod:of(absence-18, boundaries-21) cc(boundaries-21, and-22) amod(activities-25, sufficient-23) amod(activities-25, follow-on-24) nmod:of(absence-18, activities-25) conj:and(boundaries-21, activities-25) det(successes-28, the-27) nsubjpass(lost-30, successes-28) auxpass(lost-30, were-29) conj:but(achieved-4, lost-30) case(re-invasions-34, to-31) amod(re-invasions-34, subsequent-32) compound(re-invasions-34, fly-33) nmod:to(lost-30, re-invasions-34)  ",fly,33,"compound(re-invasions-34, fly-33) ",successes were lost to subsequent fly re-invasions .,NN,[],,,,,[],[],[],[],[],[],[],[],[],[],[],[],[],[],[],[],,,singular,,,unknown,unknown
The government of Zanzibar will continue for at least two years to set out traps to confirm fly eradication and to sample cattle blood to verify the absence of disease.,The/DT government/NN of/IN Zanzibar/NNP will/MD continue/VB for/IN at/IN least/JJS two/CD years/NNS to/TO set/VB out/RP traps/NNS to/TO confirm/VB fly/NN eradication/NN and/CC to/TO sample/VB cattle/NNS blood/NN to/TO verify/VB the/DT absence/NN of/IN disease/NN ./.," det(government-2, The-1) nsubj(continue-6, government-2) nsubj(set-13, government-2) case(Zanzibar-4, of-3) nmod:of(government-2, Zanzibar-4) aux(continue-6, will-5) root(ROOT-0, continue-6) case(years-11, for-7) case(least-9, at-8) nmod:npmod(two-10, least-9) nummod(years-11, two-10) nmod:for(continue-6, years-11) mark(set-13, to-12) xcomp(continue-6, set-13) compound:prt(set-13, out-14) dobj(set-13, traps-15) mark(confirm-17, to-16) dep(traps-15, confirm-17) compound(eradication-19, fly-18) dobj(confirm-17, eradication-19) cc(confirm-17, and-20) mark(sample-22, to-21) dep(traps-15, sample-22) conj:and(confirm-17, sample-22) compound(blood-24, cattle-23) dobj(sample-22, blood-24) mark(verify-26, to-25) advcl(sample-22, verify-26) det(absence-28, the-27) dobj(verify-26, absence-28) case(disease-30, of-29) nmod:of(absence-28, disease-30)  ",fly,18,"compound(eradication-19, fly-18) ",set out traps to confirm fly eradication and to sample cattle,NN,[],confirm,VB,object,[],[],[],[],[],[],[],['eradication'],[],[],[],[],[],[],[],[],[],,,singular,ambiguous,,unknown,unknown
"12 <p> SIT has been used successfully in really parts of the world to eradicate other insect pests , such as the Mediterranean fruit fly in Chile , Mexico , and California , along with the New World screwworm in Libya and Central America .","12/CD <p>/NN SIT/NN has/VBZ been/VBN used/VBN successfully/RB in/IN really/RB parts/NNS of/IN the/DT world/NN to/TO eradicate/VB other/JJ insect/NN pests/NNS ,/, such/JJ as/IN the/DT Mediterranean/NNP fruit/NN fly/NN in/IN Chile/NNP ,/, Mexico/NNP ,/, and/CC California/NNP ,/, along/IN with/IN the/DT New/NNP World/NNP screwworm/NN in/IN Libya/NNP and/CC Central/NNP America/NNP ./."," nummod(SIT-3, 12-1) compound(SIT-3, <p>-2) nsubjpass(used-6, SIT-3) nsubj(eradicate-15, SIT-3) aux(used-6, has-4) auxpass(used-6, been-5) root(ROOT-0, used-6) advmod(used-6, successfully-7) case(parts-10, in-8) advmod(parts-10, really-9) nmod:in(used-6, parts-10) case(world-13, of-11) det(world-13, the-12) nmod:of(parts-10, world-13) mark(eradicate-15, to-14) xcomp(used-6, eradicate-15) amod(pests-18, other-16) compound(pests-18, insect-17) dobj(eradicate-15, pests-18) case(fly-25, such-20) mwe(such-20, as-21) det(fly-25, the-22) compound(fly-25, Mediterranean-23) compound(fly-25, fruit-24) nmod:such_as(used-6, fly-25) case(Chile-27, in-26) nmod:in(fly-25, Chile-27) nmod:in(fly-25, Mexico-29) conj:and(Chile-27, Mexico-29) cc(Chile-27, and-31) nmod:in(fly-25, California-32) conj:and(Chile-27, California-32) advmod(fly-25, along-34) case(screwworm-39, with-35) det(screwworm-39, the-36) compound(screwworm-39, New-37) compound(screwworm-39, World-38) nmod:with(along-34, screwworm-39) case(America-44, in-40) compound(America-44, Libya-41) cc(Libya-41, and-42) conj:and(Libya-41, Central-43) compound(America-44, Central-43) nmod:in(screwworm-39, America-44)  ",fly,25,"case(fly-25, such-20) det(fly-25, the-22) compound(fly-25, Mediterranean-23) compound(fly-25, fruit-24) nmod:in(fly-25, Chile-27) nmod:in(fly-25, Mexico-29) nmod:in(fly-25, California-32) advmod(fly-25, along-34) nmod:such_as(used-6, fly-25) ","such as the Mediterranean fruit fly in Chile , Mexico ,",NN,[],,,,,"[('in', 'Chile'), ('in', 'Mexico'), ('in', 'California'), ('such_as', 'used')]","['in', 'in', 'in', 'such_as']",['used'],"['Chile', 'Mexico', 'California']",['the'],[],"['Mediterranean', 'fruit']",[],[],[],[],['such'],['along'],[],[],[],,,singular,,,unknown,unknown
"Environmental Lessons and Controversies <p> From the earliest days of widespread bush clearing , humanity 's battle against the tsetse fly has been surrounded by controversy .","Environmental/NNP Lessons/NNP and/CC Controversies/NNP <p>/VBP From/IN the/DT earliest/JJS days/NNS of/IN widespread/JJ bush/NN clearing/NN ,/, humanity/NN 's/POS battle/NN against/IN the/DT tsetse/JJ fly/NN has/VBZ been/VBN surrounded/VBN by/IN controversy/NN ./."," compound(Lessons-2, Environmental-1) nsubj(<p>-5, Lessons-2) cc(Lessons-2, and-3) conj:and(Lessons-2, Controversies-4) nsubj(<p>-5, Controversies-4) root(ROOT-0, <p>-5) case(days-9, From-6) det(days-9, the-7) amod(days-9, earliest-8) nmod:from(surrounded-24, days-9) case(clearing-13, of-10) amod(clearing-13, widespread-11) compound(clearing-13, bush-12) nmod:of(days-9, clearing-13) nmod:poss(battle-17, humanity-15) case(humanity-15, 's-16) nsubjpass(surrounded-24, battle-17) case(fly-21, against-18) det(fly-21, the-19) amod(fly-21, tsetse-20) nmod:against(battle-17, fly-21) aux(surrounded-24, has-22) auxpass(surrounded-24, been-23) ccomp(<p>-5, surrounded-24) case(controversy-26, by-25) nmod:by(surrounded-24, controversy-26)  ",fly,21,"case(fly-21, against-18) det(fly-21, the-19) amod(fly-21, tsetse-20) nmod:against(battle-17, fly-21) ",'s battle against the tsetse fly has been surrounded by controversy,NN,[],,,,,"[('against', 'battle')]",['against'],['battle'],[],['the'],[],[],['tsetse'],[],[],[],['against'],[],[],[],[],,,singular,,,unknown,unknown
"Drive out the tsetse fly and the whole landscape changes . """,Drive/VB out/RP the/DT tsetse/JJ fly/NN and/CC the/DT whole/JJ landscape/NN changes/NNS ./. ''/''," root(ROOT-0, Drive-1) compound:prt(Drive-1, out-2) det(fly-5, the-3) amod(fly-5, tsetse-4) dobj(Drive-1, fly-5) cc(fly-5, and-6) det(changes-10, the-7) amod(changes-10, whole-8) compound(changes-10, landscape-9) dobj(Drive-1, changes-10) conj:and(fly-5, changes-10)  ",fly,5,"det(fly-5, the-3) amod(fly-5, tsetse-4) cc(fly-5, and-6) conj:and(fly-5, changes-10) dobj(Drive-1, fly-5) ",Drive out the tsetse fly and the whole landscape changes,NN,[],Drive,VB,object,[],[],[],[],[],['the'],"[('and', 'changes')]",[],['tsetse'],[],[],[],[],[],[],[],[],,,singular,ambiguous,,unknown,unknown
"<p> Third , pesticide applications -- a significant concern in many tsetse control operations -- are terminated ( from already low levels ) when SIT results in fly eradication , and this inevitably helps to stabilize and conserve the environment.","<p>/NNP Third/NNP ,/, pesticide/NN applications/NNS --/: a/DT significant/JJ concern/NN in/IN many/JJ tsetse/NN control/NN operations/NNS --/: are/VBP terminated/VBN -LRB-/-LRB- from/IN already/RB low/JJ levels/NNS -RRB-/-RRB- when/WRB SIT/NNP results/VBZ in/IN fly/NN eradication/NN ,/, and/CC this/DT inevitably/RB helps/VBZ to/TO stabilize/VB and/CC conserve/VB the/DT environment/NN ./."," compound(Third-2, <p>-1) nsubjpass(terminated-17, Third-2) compound(applications-5, pesticide-4) appos(Third-2, applications-5) det(concern-9, a-7) amod(concern-9, significant-8) dep(applications-5, concern-9) case(operations-14, in-10) amod(operations-14, many-11) compound(operations-14, tsetse-12) compound(operations-14, control-13) nmod:in(concern-9, operations-14) auxpass(terminated-17, are-16) root(ROOT-0, terminated-17) case(levels-22, from-19) advmod(low-21, already-20) amod(levels-22, low-21) dep(terminated-17, levels-22) advmod(results-26, when-24) nsubj(results-26, SIT-25) advcl(terminated-17, results-26) case(eradication-29, in-27) compound(eradication-29, fly-28) nmod:in(results-26, eradication-29) cc(terminated-17, and-31) nsubj(helps-34, this-32) nsubj(stabilize-36, this-32) nsubj(conserve-38, this-32) advmod(helps-34, inevitably-33) conj:and(terminated-17, helps-34) mark(stabilize-36, to-35) xcomp(helps-34, stabilize-36) cc(stabilize-36, and-37) xcomp(helps-34, conserve-38) conj:and(stabilize-36, conserve-38) det(environment-40, the-39) dobj(stabilize-36, environment-40)  ",fly,28,"compound(eradication-29, fly-28) ",") when SIT results in fly eradication , and this inevitably",NN,[],,,,,[],[],[],[],[],[],['eradication'],[],[],[],[],[],[],[],[],[],,,singular,,,unknown,unknown
"Game parks , such as Kruger Park in South Africa , can be preserved by governmental action even without the tsetse fly .","Game/NN parks/NNS ,/, such/JJ as/IN Kruger/NNP Park/NNP in/IN South/NNP Africa/NNP ,/, can/MD be/VB preserved/VBN by/IN governmental/JJ action/NN even/RB without/IN the/DT tsetse/JJ fly/NN ./."," compound(parks-2, Game-1) nsubjpass(preserved-14, parks-2) case(Park-7, such-4) mwe(such-4, as-5) compound(Park-7, Kruger-6) nmod:such_as(parks-2, Park-7) case(Africa-10, in-8) compound(Africa-10, South-9) nmod:in(Park-7, Africa-10) aux(preserved-14, can-12) auxpass(preserved-14, be-13) root(ROOT-0, preserved-14) case(action-17, by-15) amod(action-17, governmental-16) nmod:by(preserved-14, action-17) advmod(fly-22, even-18) case(fly-22, without-19) det(fly-22, the-20) amod(fly-22, tsetse-21) nmod:without(preserved-14, fly-22)  ",fly,22,"advmod(fly-22, even-18) case(fly-22, without-19) det(fly-22, the-20) amod(fly-22, tsetse-21) nmod:without(preserved-14, fly-22) ",action even without the tsetse fly .,NN,[],,,,,"[('without', 'preserved')]",['without'],['preserved'],[],['the'],[],[],['tsetse'],[],[],[],['without'],['even'],[],[],[],,,singular,,,unknown,unknown
