"This kind of display enables music on a piano roll to be read "" on the fly , "" the same way traditional notation is read .","This/DT kind/NN of/IN display/NN enables/VBZ music/NN on/IN a/DT piano/NN roll/NN to/TO be/VB read/VBN ''/'' on/IN the/DT fly/NN ,/, ''/'' the/DT same/JJ way/NN traditional/JJ notation/NN is/VBZ read/VBN ./."," det(kind-2, This-1) nsubj(enables-5, kind-2) case(display-4, of-3) nmod:of(kind-2, display-4) ccomp(read-26, enables-5) dobj(enables-5, music-6) case(roll-10, on-7) det(roll-10, a-8) compound(roll-10, piano-9) nmod:on(enables-5, roll-10) mark(read-13, to-11) auxpass(read-13, be-12) advcl(enables-5, read-13) case(fly-17, on-15) det(fly-17, the-16) nmod:on(read-13, fly-17) det(notation-24, the-20) amod(notation-24, same-21) compound(notation-24, way-22) amod(notation-24, traditional-23) nsubjpass(read-26, notation-24) auxpass(read-26, is-25) root(ROOT-0, read-26)  ",fly,17,"case(fly-17, on-15) det(fly-17, the-16) nmod:on(read-13, fly-17) ","be read "" on the fly , "" the same way",NN,[],,,,,"[('on', 'read')]",['on'],['read'],[],['the'],[],[],[],[],[],[],['on'],[],[],[],[],,,singular,,,unknown,unknown
"The most promising candidates include four additional species native to Australia : a beneficial sawfly , a sap-feeding psyllid ( SILL-id ) , a tube-dwelling moth , and a gall-forming fly .","The/DT most/RBS promising/JJ candidates/NNS include/VBP four/CD additional/JJ species/NN native/NN to/TO Australia/NNP :/: a/DT beneficial/JJ sawfly/NN ,/, a/DT sap-feeding/JJ psyllid/NN -LRB-/-LRB- SILL-id/NNP -RRB-/-RRB- ,/, a/DT tube-dwelling/JJ moth/NN ,/, and/CC a/DT gall-forming/JJ fly/NN ./."," det(candidates-4, The-1) advmod(candidates-4, most-2) amod(candidates-4, promising-3) nsubj(include-5, candidates-4) root(ROOT-0, include-5) nummod(native-9, four-6) amod(native-9, additional-7) compound(native-9, species-8) dobj(include-5, native-9) case(Australia-11, to-10) nmod:to(include-5, Australia-11) det(sawfly-15, a-13) amod(sawfly-15, beneficial-14) dobj(include-5, sawfly-15) det(psyllid-19, a-17) amod(psyllid-19, sap-feeding-18) dobj(include-5, psyllid-19) conj:and(sawfly-15, psyllid-19) appos(psyllid-19, SILL-id-21) det(moth-26, a-24) amod(moth-26, tube-dwelling-25) dobj(include-5, moth-26) conj:and(sawfly-15, moth-26) cc(sawfly-15, and-28) det(fly-31, a-29) amod(fly-31, gall-forming-30) dobj(include-5, fly-31) conj:and(sawfly-15, fly-31)  ",fly,31,"det(fly-31, a-29) amod(fly-31, gall-forming-30) dobj(include-5, fly-31) conj:and(sawfly-15, fly-31) ","moth , and a gall-forming fly .",NN,[],include,VBP,object,[],[],[],[],[],['a'],"[('and', 'sawfly')]",[],[],[],[],[],[],[],[],[],[],a,unit,singular,plural,A+NEX-PL,countable,unknown
"<p> Studies elsewhere with another Fergusonina gall-forming fly showed that nematodes invade the ovaries of the female fly larvae and are later expelled when the female lays her eggs . """,<p>/NN Studies/NNS elsewhere/RB with/IN another/DT Fergusonina/NNP gall-forming/JJ fly/NN showed/VBD that/IN nematodes/NNS invade/VBP the/DT ovaries/NNS of/IN the/DT female/JJ fly/NN larvae/NN and/CC are/VBP later/RB expelled/VBN when/WRB the/DT female/NN lays/VBZ her/PRP$ eggs/NNS ./. ''/''," compound(Studies-2, <p>-1) nsubj(showed-9, Studies-2) nsubjpass(expelled-23, Studies-2) advmod(showed-9, elsewhere-3) case(fly-8, with-4) det(fly-8, another-5) compound(fly-8, Fergusonina-6) amod(fly-8, gall-forming-7) nmod:with(elsewhere-3, fly-8) root(ROOT-0, showed-9) mark(invade-12, that-10) nsubj(invade-12, nematodes-11) ccomp(showed-9, invade-12) det(ovaries-14, the-13) dobj(invade-12, ovaries-14) case(larvae-19, of-15) det(larvae-19, the-16) amod(larvae-19, female-17) compound(larvae-19, fly-18) nmod:of(ovaries-14, larvae-19) cc(showed-9, and-20) auxpass(expelled-23, are-21) advmod(expelled-23, later-22) conj:and(showed-9, expelled-23) advmod(lays-27, when-24) det(female-26, the-25) nsubj(lays-27, female-26) advcl(expelled-23, lays-27) nmod:poss(eggs-29, her-28) dobj(lays-27, eggs-29)  ",fly,8,"case(fly-8, with-4) det(fly-8, another-5) compound(fly-8, Fergusonina-6) amod(fly-8, gall-forming-7) nmod:with(elsewhere-3, fly-8) ",elsewhere with another Fergusonina gall-forming fly showed that nematodes invade the,NN,[],,,,,"[('with', 'elsewhere')]",['with'],['elsewhere'],[],['another'],[],['Fergusonina'],[],[],[],[],['with'],[],[],[],[],,,singular,,,unknown,unknown
"<p> Studies elsewhere with another Fergusonina gall-forming fly showed that nematodes invade the ovaries of the female fly larvae and are later expelled when the female lays her eggs . """,<p>/NN Studies/NNS elsewhere/RB with/IN another/DT Fergusonina/NNP gall-forming/JJ fly/NN showed/VBD that/IN nematodes/NNS invade/VBP the/DT ovaries/NNS of/IN the/DT female/JJ fly/NN larvae/NN and/CC are/VBP later/RB expelled/VBN when/WRB the/DT female/NN lays/VBZ her/PRP$ eggs/NNS ./. ''/''," compound(Studies-2, <p>-1) nsubj(showed-9, Studies-2) nsubjpass(expelled-23, Studies-2) advmod(showed-9, elsewhere-3) case(fly-8, with-4) det(fly-8, another-5) compound(fly-8, Fergusonina-6) amod(fly-8, gall-forming-7) nmod:with(elsewhere-3, fly-8) root(ROOT-0, showed-9) mark(invade-12, that-10) nsubj(invade-12, nematodes-11) ccomp(showed-9, invade-12) det(ovaries-14, the-13) dobj(invade-12, ovaries-14) case(larvae-19, of-15) det(larvae-19, the-16) amod(larvae-19, female-17) compound(larvae-19, fly-18) nmod:of(ovaries-14, larvae-19) cc(showed-9, and-20) auxpass(expelled-23, are-21) advmod(expelled-23, later-22) conj:and(showed-9, expelled-23) advmod(lays-27, when-24) det(female-26, the-25) nsubj(lays-27, female-26) advcl(expelled-23, lays-27) nmod:poss(eggs-29, her-28) dobj(lays-27, eggs-29)  ",fly,18,"compound(larvae-19, fly-18) ",the ovaries of the female fly larvae and are later expelled,NN,[],,,,,[],[],[],[],[],[],['larvae'],[],[],[],[],[],[],[],[],[],,,singular,,,unknown,unknown
"That same process , "" says Purcell , "" probably occurs with the fly that inhabits melaleuca galls .","That/DT same/JJ process/NN ,/, ''/'' says/VBZ Purcell/NNP ,/, ''/'' probably/RB occurs/VBZ with/IN the/DT fly/NN that/WDT inhabits/VBZ melaleuca/NN galls/NNS ./."," det(process-3, That-1) amod(process-3, same-2) nsubj(occurs-11, process-3) acl:relcl(process-3, says-6) dobj(says-6, Purcell-7) advmod(occurs-11, probably-10) root(ROOT-0, occurs-11) case(fly-14, with-12) det(fly-14, the-13) nmod:with(occurs-11, fly-14) nsubj(inhabits-16, fly-14) ref(fly-14, that-15) acl:relcl(fly-14, inhabits-16) compound(galls-18, melaleuca-17) dobj(inhabits-16, galls-18)  ",fly,14,"case(fly-14, with-12) det(fly-14, the-13) ref(fly-14, that-15) acl:relcl(fly-14, inhabits-16) nmod:with(occurs-11, fly-14) nsubj(inhabits-16, fly-14) ",""" probably occurs with the fly that inhabits melaleuca galls .",NN,[],inhabits,VBZ,subject,[],"[('with', 'occurs')]",['with'],['occurs'],[],['the'],[],[],[],[],[],[],['with'],[],[],[],[],,,singular,singular,,unknown,unknown
"<p> "" We 're trying to determine if the nematode causes galls or , alternatively , whether galls form in response to some chemical released by the female fly when she lays her eggs .","<p>/NN ''/'' We/PRP 're/VBP trying/VBG to/TO determine/VB if/IN the/DT nematode/NN causes/VBZ galls/NNS or/CC ,/, alternatively/RB ,/, whether/IN galls/JJ form/NN in/IN response/NN to/TO some/DT chemical/NN released/VBN by/IN the/DT female/JJ fly/NN when/WRB she/PRP lays/VBZ her/PRP$ eggs/NNS ./."," dep(trying-5, <p>-1) nsubj(trying-5, We-3) nsubj(determine-7, We-3) aux(trying-5, 're-4) root(ROOT-0, trying-5) mark(determine-7, to-6) xcomp(trying-5, determine-7) mark(causes-11, if-8) det(nematode-10, the-9) nsubj(causes-11, nematode-10) advcl(determine-7, causes-11) dobj(causes-11, galls-12) cc(form-19, or-13) dep(form-19, alternatively-15) amod(form-19, whether-17) amod(form-19, galls-18) dep(causes-11, form-19) case(response-21, in-20) nmod:in(form-19, response-21) case(chemical-24, to-22) det(chemical-24, some-23) nmod:to(causes-11, chemical-24) acl(chemical-24, released-25) case(fly-29, by-26) det(fly-29, the-27) amod(fly-29, female-28) nmod:by(released-25, fly-29) advmod(lays-32, when-30) nsubj(lays-32, she-31) acl:relcl(fly-29, lays-32) nmod:poss(eggs-34, her-33) dobj(lays-32, eggs-34)  ",fly,29,"case(fly-29, by-26) det(fly-29, the-27) amod(fly-29, female-28) acl:relcl(fly-29, lays-32) nmod:by(released-25, fly-29) ",chemical released by the female fly when she lays her eggs,NN,[],,,,,"[('by', 'released')]",['by'],['released'],[],['the'],[],[],['female'],[],[],[],['by'],[],[],[],[],,,singular,,,unknown,unknown
"He set up six composters and filled each with a mix of animal bedding , paper bags , ground up food residuals from the university 's Somat pulper , coffee grounds and fruit fly agar .","He/PRP set/VBD up/RP six/CD composters/NNS and/CC filled/VBD each/DT with/IN a/DT mix/NN of/IN animal/NN bedding/NN ,/, paper/NN bags/NNS ,/, ground/VB up/RP food/NN residuals/NNS from/IN the/DT university/NN 's/POS Somat/JJ pulper/NN ,/, coffee/NN grounds/NNS and/CC fruit/NN fly/NN agar/NN ./."," nsubj(set-2, He-1) nsubj(filled-7, He-1) root(ROOT-0, set-2) compound:prt(set-2, up-3) nummod(composters-5, six-4) dobj(set-2, composters-5) cc(set-2, and-6) conj:and(set-2, filled-7) dobj(filled-7, each-8) case(mix-11, with-9) det(mix-11, a-10) nmod:with(each-8, mix-11) case(bedding-14, of-12) compound(bedding-14, animal-13) nmod:of(mix-11, bedding-14) compound(bags-17, paper-16) appos(bedding-14, bags-17) dep(filled-7, ground-19) compound:prt(ground-19, up-20) compound(residuals-22, food-21) dobj(ground-19, residuals-22) case(grounds-31, from-23) det(university-25, the-24) nmod:poss(grounds-31, university-25) case(university-25, 's-26) amod(grounds-31, Somat-27) compound(grounds-31, pulper-28) dep(grounds-31, coffee-30) nmod:from(ground-19, grounds-31) cc(grounds-31, and-32) compound(agar-35, fruit-33) compound(agar-35, fly-34) nmod:from(ground-19, agar-35) conj:and(grounds-31, agar-35)  ",fly,34,"compound(agar-35, fly-34) ",", coffee grounds and fruit fly agar .",NN,[],,,,,[],[],[],[],[],[],['agar'],[],[],[],[],[],[],[],[],[],,,singular,,,unknown,unknown
"Our previous experience on metal contaminated sites indicates that the application of highiron ( Fe ) biosolids , in combination with a high-calcium carbonate material such as wood or fly ash , is able to restore and sustain a vegetative cover .","Our/PRP$ previous/JJ experience/NN on/IN metal/NN contaminated/VBN sites/NNS indicates/VBZ that/IN the/DT application/NN of/IN highiron/JJ -LRB-/-LRB- Fe/NNP -RRB-/-RRB- biosolids/NNS ,/, in/IN combination/NN with/IN a/DT high-calcium/JJ carbonate/NN material/NN such/JJ as/IN wood/NN or/CC fly/NN ash/NNS ,/, is/VBZ able/JJ to/TO restore/VB and/CC sustain/VB a/DT vegetative/JJ cover/NN ./."," nmod:poss(experience-3, Our-1) amod(experience-3, previous-2) nsubj(indicates-8, experience-3) case(sites-7, on-4) dep(contaminated-6, metal-5) amod(sites-7, contaminated-6) nmod:on(experience-3, sites-7) root(ROOT-0, indicates-8) mark(able-34, that-9) det(application-11, the-10) nsubj(able-34, application-11) nsubj(restore-36, application-11) nsubj(sustain-38, application-11) case(biosolids-17, of-12) amod(biosolids-17, highiron-13) appos(biosolids-17, Fe-15) nmod:of(application-11, biosolids-17) case(combination-20, in-19) nmod:in(able-34, combination-20) case(material-25, with-21) det(material-25, a-22) amod(material-25, high-calcium-23) compound(material-25, carbonate-24) nmod:with(combination-20, material-25) case(ash-31, such-26) mwe(such-26, as-27) compound(ash-31, wood-28) cc(wood-28, or-29) conj:or(wood-28, fly-30) compound(ash-31, fly-30) nmod:such_as(material-25, ash-31) cop(able-34, is-33) ccomp(indicates-8, able-34) mark(restore-36, to-35) xcomp(able-34, restore-36) cc(restore-36, and-37) xcomp(able-34, sustain-38) conj:and(restore-36, sustain-38) det(cover-41, a-39) amod(cover-41, vegetative-40) dobj(restore-36, cover-41)  ",fly,30,"conj:or(wood-28, fly-30) compound(ash-31, fly-30) ","material such as wood or fly ash , is able to",NN,[],,,,,[],[],[],[],[],"[('or', 'wood')]",['ash'],[],[],[],[],[],[],[],[],[],,,singular,,,unknown,unknown
( Certain grades of fly ash have been used in concrete . ),-LRB-/-LRB- Certain/JJ grades/NNS of/IN fly/NN ash/NNS have/VBP been/VBN used/VBN in/IN concrete/NN ./. -RRB-/-RRB-," amod(grades-3, Certain-2) nsubjpass(used-9, grades-3) case(ash-6, of-4) compound(ash-6, fly-5) nmod:of(grades-3, ash-6) aux(used-9, have-7) auxpass(used-9, been-8) root(ROOT-0, used-9) case(concrete-11, in-10) nmod:in(used-9, concrete-11)  ",fly,5,"compound(ash-6, fly-5) ",( Certain grades of fly ash have been used in,NN,[],,,,,[],[],[],[],[],[],['ash'],[],[],[],[],[],[],[],[],[],,,singular,,,unknown,unknown
"The defective PU is fenced "" on the fly , "" and the remaining system , including all L2 caches , continues with processing , thus enhancing availability to the user .","The/DT defective/JJ PU/NN is/VBZ fenced/VBN ''/'' on/IN the/DT fly/NN ,/, ''/'' and/CC the/DT remaining/VBG system/NN ,/, including/VBG all/DT L2/CD caches/NNS ,/, continues/VBZ with/IN processing/VBG ,/, thus/RB enhancing/VBG availability/NN to/TO the/DT user/NN ./."," det(PU-3, The-1) amod(PU-3, defective-2) nsubjpass(fenced-5, PU-3) auxpass(fenced-5, is-4) root(ROOT-0, fenced-5) case(fly-9, on-7) det(fly-9, the-8) nmod:on(fenced-5, fly-9) cc(fenced-5, and-12) det(system-15, the-13) amod(system-15, remaining-14) nsubj(continues-22, system-15) case(caches-20, including-17) det(caches-20, all-18) nummod(caches-20, L2-19) nmod:including(system-15, caches-20) conj:and(fenced-5, continues-22) mark(processing-24, with-23) advcl(continues-22, processing-24) advmod(processing-24, thus-26) advcl(processing-24, enhancing-27) dobj(enhancing-27, availability-28) case(user-31, to-29) det(user-31, the-30) nmod:to(enhancing-27, user-31)  ",fly,9,"case(fly-9, on-7) det(fly-9, the-8) nmod:on(fenced-5, fly-9) ","is fenced "" on the fly , "" and the remaining",NN,[],,,,,"[('on', 'fenced')]",['on'],['fenced'],[],['the'],[],[],[],[],[],[],['on'],[],[],[],[],,,singular,,,unknown,unknown
<p> Redundancy setting per DRAM module on the fly .,<p>/NNP Redundancy/NNP setting/VBG per/IN DRAM/NNP module/VBP on/IN the/DT fly/NN ./.," compound(Redundancy-2, <p>-1) nsubj(module-6, Redundancy-2) acl(Redundancy-2, setting-3) case(DRAM-5, per-4) nmod:per(setting-3, DRAM-5) root(ROOT-0, module-6) case(fly-9, on-7) det(fly-9, the-8) nmod:on(module-6, fly-9)  ",fly,9,"case(fly-9, on-7) det(fly-9, the-8) nmod:on(module-6, fly-9) ",per DRAM module on the fly .,NN,[],,,,,"[('on', 'module')]",['on'],['module'],[],['the'],[],[],[],[],[],[],['on'],[],[],[],[],,,singular,,,unknown,unknown
"This gives the capability of DRAM chip-kill correction on the fly , without impact to the running application .","This/DT gives/VBZ the/DT capability/NN of/IN DRAM/NNP chip-kill/JJ correction/NN on/IN the/DT fly/NN ,/, without/IN impact/NN to/TO the/DT running/VBG application/NN ./."," nsubj(gives-2, This-1) root(ROOT-0, gives-2) det(capability-4, the-3) iobj(gives-2, capability-4) case(DRAM-6, of-5) nmod:of(capability-4, DRAM-6) amod(correction-8, chip-kill-7) dobj(gives-2, correction-8) case(fly-11, on-9) det(fly-11, the-10) nmod:on(gives-2, fly-11) case(impact-14, without-13) nmod:without(fly-11, impact-14) case(application-18, to-15) det(application-18, the-16) amod(application-18, running-17) nmod:to(impact-14, application-18)  ",fly,11,"case(fly-11, on-9) det(fly-11, the-10) nmod:without(fly-11, impact-14) nmod:on(gives-2, fly-11) ","DRAM chip-kill correction on the fly , without impact to the",NN,[],,,,,"[('without', 'impact'), ('on', 'gives')]","['without', 'on']",['gives'],['impact'],['the'],[],[],[],[],[],[],['on'],[],[],[],[],,,singular,,,unknown,unknown
"Error correction in all cases is provided "" on the fly , "" with no additional access penalty .","Error/JJ correction/NN in/IN all/DT cases/NNS is/VBZ provided/VBN ''/'' on/IN the/DT fly/NN ,/, ''/'' with/IN no/DT additional/JJ access/NN penalty/NN ./."," amod(correction-2, Error-1) nsubjpass(provided-7, correction-2) case(cases-5, in-3) det(cases-5, all-4) nmod:in(correction-2, cases-5) auxpass(provided-7, is-6) root(ROOT-0, provided-7) case(fly-11, on-9) det(fly-11, the-10) nmod:on(provided-7, fly-11) case(penalty-18, with-14) neg(penalty-18, no-15) amod(penalty-18, additional-16) compound(penalty-18, access-17) nmod:with(fly-11, penalty-18)  ",fly,11,"case(fly-11, on-9) det(fly-11, the-10) nmod:with(fly-11, penalty-18) nmod:on(provided-7, fly-11) ","is provided "" on the fly , "" with no additional",NN,[],,,,,"[('with', 'penalty'), ('on', 'provided')]","['with', 'on']",['provided'],['penalty'],['the'],[],[],[],[],[],[],['on'],[],[],[],[],,,singular,,,unknown,unknown
"The whole family watched me catch my first redfish just off Mobile Bay , and I caught my first fish on a fly under the approving eye of my mother .","The/DT whole/JJ family/NN watched/VBD me/PRP catch/VB my/PRP$ first/JJ redfish/NN just/RB off/IN Mobile/NNP Bay/NNP ,/, and/CC I/PRP caught/VBD my/PRP$ first/JJ fish/NN on/IN a/DT fly/NN under/IN the/DT approving/JJ eye/NN of/IN my/PRP$ mother/NN ./."," det(family-3, The-1) amod(family-3, whole-2) nsubj(watched-4, family-3) root(ROOT-0, watched-4) nsubj(catch-6, me-5) ccomp(watched-4, catch-6) nmod:poss(redfish-9, my-7) amod(redfish-9, first-8) dobj(catch-6, redfish-9) advmod(catch-6, just-10) case(Bay-13, off-11) compound(Bay-13, Mobile-12) nmod:off(catch-6, Bay-13) cc(watched-4, and-15) nsubj(caught-17, I-16) conj:and(watched-4, caught-17) nmod:poss(fish-20, my-18) amod(fish-20, first-19) dobj(caught-17, fish-20) case(fly-23, on-21) det(fly-23, a-22) nmod:on(caught-17, fly-23) case(eye-27, under-24) det(eye-27, the-25) amod(eye-27, approving-26) nmod:under(caught-17, eye-27) case(mother-30, of-28) nmod:poss(mother-30, my-29) nmod:of(eye-27, mother-30)  ",fly,23,"case(fly-23, on-21) det(fly-23, a-22) nmod:on(caught-17, fly-23) ",my first fish on a fly under the approving eye of,NN,[],,,,,"[('on', 'caught')]",['on'],['caught'],[],['a'],[],[],[],[],[],[],['on'],[],[],[],[],a,unit,singular,,A+N,countable,unknown
</P> Circle 194 on Reader Service Card </P> PRE-FORMATTED Processes all types of fly ash and dust regardless of chemical composition .,</P>/NNP Circle/NNP 194/NNP on/IN Reader/NNP Service/NNP Card/NNP </P>/NNP PRE-FORMATTED/NNP Processes/VBZ all/DT types/NNS of/IN fly/NN ash/NN and/CC dust/NN regardless/RB of/IN chemical/NN composition/NN ./.," compound(194-3, </P>-1) compound(194-3, Circle-2) nsubj(Processes-10, 194-3) case(PRE-FORMATTED-9, on-4) compound(PRE-FORMATTED-9, Reader-5) compound(PRE-FORMATTED-9, Service-6) compound(PRE-FORMATTED-9, Card-7) compound(PRE-FORMATTED-9, </P>-8) nmod:on(194-3, PRE-FORMATTED-9) root(ROOT-0, Processes-10) det(types-12, all-11) dobj(Processes-10, types-12) case(ash-15, of-13) compound(ash-15, fly-14) nmod:of(types-12, ash-15) cc(ash-15, and-16) nmod:of(types-12, dust-17) conj:and(ash-15, dust-17) case(composition-21, regardless-18) mwe(regardless-18, of-19) compound(composition-21, chemical-20) nmod:regardless_of(Processes-10, composition-21)  ",fly,14,"compound(ash-15, fly-14) ",PRE-FORMATTED Processes all types of fly ash and dust regardless of,NN,[],,,,,[],[],[],[],[],[],['ash'],[],[],[],[],[],[],[],[],[],,,singular,,,unknown,unknown
The KE series power-lock shaft/hub locking device has been designed to eliminate specially machined seats and guides while providing power to secure driven components to a shaft without cos fly machining and centering operations .,The/DT KE/NNP series/NN power-lock/NN shaft/hub/NN locking/VBG device/NN has/VBZ been/VBN designed/VBN to/TO eliminate/VB specially/RB machined/JJ seats/NNS and/CC guides/NNS while/IN providing/VBG power/NN to/TO secure/VB driven/VBN components/NNS to/TO a/DT shaft/NN without/IN cos/NN fly/NN machining/NN and/CC centering/VBG operations/NNS ./.," det(shaft/hub-5, The-1) compound(shaft/hub-5, KE-2) compound(shaft/hub-5, series-3) compound(shaft/hub-5, power-lock-4) nsubjpass(designed-10, shaft/hub-5) nsubj(eliminate-12, shaft/hub-5) acl(shaft/hub-5, locking-6) dobj(locking-6, device-7) aux(designed-10, has-8) auxpass(designed-10, been-9) root(ROOT-0, designed-10) mark(eliminate-12, to-11) xcomp(designed-10, eliminate-12) advmod(machined-14, specially-13) amod(seats-15, machined-14) dobj(eliminate-12, seats-15) cc(seats-15, and-16) dobj(eliminate-12, guides-17) conj:and(seats-15, guides-17) mark(providing-19, while-18) advcl(eliminate-12, providing-19) dobj(providing-19, power-20) mark(secure-22, to-21) advcl(providing-19, secure-22) dep(secure-22, driven-23) dobj(driven-23, components-24) case(shaft-27, to-25) det(shaft-27, a-26) nmod:to(driven-23, shaft-27) case(machining-31, without-28) compound(machining-31, cos-29) compound(machining-31, fly-30) nmod:without(driven-23, machining-31) cc(providing-19, and-32) advcl(eliminate-12, centering-33) conj:and(providing-19, centering-33) dobj(centering-33, operations-34)  ",fly,30,"compound(machining-31, fly-30) ",to a shaft without cos fly machining and centering operations .,NN,[],,,,,[],[],[],[],[],[],['machining'],[],[],[],[],[],[],[],[],[],,,singular,,,unknown,unknown
"The emphasis is on interactivity : empowering engineers to go beyond visualizing last week 's model to actually changing component designs on the fly and evaluating , in real time , the impact of those changes on the ability to assemble , use , and maintain the complete product or system .","The/DT emphasis/NN is/VBZ on/IN interactivity/NN :/: empowering/VBG engineers/NNS to/TO go/VB beyond/IN visualizing/VBG last/JJ week/NN 's/POS model/NN to/TO actually/RB changing/VBG component/NN designs/NNS on/IN the/DT fly/NN and/CC evaluating/VBG ,/, in/IN real/JJ time/NN ,/, the/DT impact/NN of/IN those/DT changes/NNS on/IN the/DT ability/NN to/TO assemble/VB ,/, use/VB ,/, and/CC maintain/VB the/DT complete/JJ product/NN or/CC system/NN ./."," det(emphasis-2, The-1) nsubj(interactivity-5, emphasis-2) cop(interactivity-5, is-3) case(interactivity-5, on-4) root(ROOT-0, interactivity-5) parataxis(interactivity-5, empowering-7) dobj(empowering-7, engineers-8) mark(go-10, to-9) advcl(empowering-7, go-10) mark(visualizing-12, beyond-11) advcl(go-10, visualizing-12) amod(week-14, last-13) nmod:poss(model-16, week-14) case(week-14, 's-15) dobj(visualizing-12, model-16) mark(changing-19, to-17) advmod(changing-19, actually-18) advcl(visualizing-12, changing-19) compound(designs-21, component-20) dobj(changing-19, designs-21) case(fly-24, on-22) det(fly-24, the-23) nmod:on(changing-19, fly-24) cc(changing-19, and-25) advcl(visualizing-12, evaluating-26) conj:and(changing-19, evaluating-26) case(time-30, in-28) amod(time-30, real-29) nmod:in(evaluating-26, time-30) det(impact-33, the-32) dobj(evaluating-26, impact-33) case(changes-36, of-34) det(changes-36, those-35) nmod:of(impact-33, changes-36) case(ability-39, on-37) det(ability-39, the-38) nmod:on(changes-36, ability-39) mark(assemble-41, to-40) acl(ability-39, assemble-41) acl(ability-39, use-43) conj:and(assemble-41, use-43) cc(assemble-41, and-45) acl(ability-39, maintain-46) conj:and(assemble-41, maintain-46) det(product-49, the-47) amod(product-49, complete-48) dobj(assemble-41, product-49) cc(product-49, or-50) dobj(assemble-41, system-51) conj:or(product-49, system-51)  ",fly,24,"case(fly-24, on-22) det(fly-24, the-23) nmod:on(changing-19, fly-24) ","changing component designs on the fly and evaluating , in real",NN,[],,,,,"[('on', 'changing')]",['on'],['changing'],[],['the'],[],[],[],[],[],[],['on'],[],[],[],[],,,singular,,,unknown,unknown
"As a result , engineers can now make changes in component designs and -- after determining the impact on the part 's structural integrity and manufacturability -- determine on the fly how those changes will affect how the product is operated or serviced , for example . ""","As/IN a/DT result/NN ,/, engineers/NNS can/MD now/RB make/VB changes/NNS in/IN component/NN designs/NNS and/CC --/: after/IN determining/VBG the/DT impact/NN on/IN the/DT part/NN 's/POS structural/JJ integrity/NN and/CC manufacturability/RB --/: determine/VB on/IN the/DT fly/NN how/WRB those/DT changes/NNS will/MD affect/VB how/WRB the/DT product/NN is/VBZ operated/VBN or/CC serviced/VBN ,/, for/IN example/NN ./. ''/''"," case(result-3, As-1) det(result-3, a-2) nmod:as(make-8, result-3) nsubj(make-8, engineers-5) nsubj(determine-28, engineers-5) aux(make-8, can-6) advmod(make-8, now-7) root(ROOT-0, make-8) dobj(make-8, changes-9) case(designs-12, in-10) compound(designs-12, component-11) nmod:in(make-8, designs-12) cc(make-8, and-13) case(determining-16, after-15) dep(make-8, determining-16) det(impact-18, the-17) dobj(determining-16, impact-18) case(integrity-24, on-19) det(part-21, the-20) nmod:poss(integrity-24, part-21) case(part-21, 's-22) amod(integrity-24, structural-23) nmod:on(determining-16, integrity-24) cc(determining-16, and-25) dep(make-8, manufacturability-26) conj:and(determining-16, manufacturability-26) conj:and(make-8, determine-28) case(fly-31, on-29) det(fly-31, the-30) nmod:on(determine-28, fly-31) advmod(affect-36, how-32) det(changes-34, those-33) nsubj(affect-36, changes-34) aux(affect-36, will-35) ccomp(determine-28, affect-36) advmod(operated-41, how-37) det(product-39, the-38) nsubjpass(operated-41, product-39) nsubjpass(serviced-43, product-39) auxpass(operated-41, is-40) ccomp(affect-36, operated-41) cc(operated-41, or-42) ccomp(affect-36, serviced-43) conj:or(operated-41, serviced-43) case(example-46, for-45) nmod:for(make-8, example-46)  ",fly,31,"case(fly-31, on-29) det(fly-31, the-30) nmod:on(determine-28, fly-31) ",manufacturability -- determine on the fly how those changes will affect,NN,[],,,,,"[('on', 'determine')]",['on'],['determine'],[],['the'],[],[],[],[],[],[],['on'],[],[],[],[],,,singular,,,unknown,unknown
